<?xml version="1.0"?>
<!DOCTYPE Report
[
<!ELEMENT Report (General ,(Doc|BPT)) >
<!ATTLIST Report ver CDATA #REQUIRED tmZone CDATA #REQUIRED>

<!ELEMENT General ( DocLocation ) >
<!ATTLIST General productName CDATA #REQUIRED productVer CDATA #REQUIRED os CDATA #REQUIRED host CDATA #REQUIRED qcserver CDATA #IMPLIED qcproject CDATA #IMPLIED SolManSolutionId CDATA #IMPLIED SolManProjectId CDATA #IMPLIED SolManTestPlanId CDATA #IMPLIED SolManTestPackageId CDATA #IMPLIED SolManUserInfoData CDATA #IMPLIED  >

<!ELEMENT BPT (DName,Res,DVer?,TSet?,TInst?,NodeArgs,AdditionalInfo*,Doc*) >
<!ATTLIST BPT rID ID #REQUIRED >

<!ELEMENT Doc (DName,ConfName?,Res,DVer?,TSet?,TInst?,RunType?,DT?,AdditionalInfo*,Step*,DIter*,Step*,Action*,Doc*,Summary?,TestMaintenanceSummary*,NodeArgs?) >
<!ATTLIST Doc rID ID #REQUIRED type (Test|BC|BPTWrapperTest|Flow|Group|Action) "Test" productName CDATA #REQUIRED BCIter CDATA #IMPLIED >

<!ELEMENT RunType ( #PCDATA )>
<!ATTLIST RunType fmStep (False|True) "False" batch (False|True) "False" upDesc (False|True) "False" upChk (False|True) "False" upAS (False|True) "False">

<!ELEMENT DName ( #PCDATA ) >

<!ELEMENT ConfName ( #PCDATA ) >

<!ELEMENT Res ( #PCDATA ) >

<!ELEMENT AdditionalInfo (AdditionalDataName,AdditionalDataValue ) >

<!ELEMENT AdditionalDataName ( #PCDATA ) >

<!ELEMENT AdditionalDataValue ( #PCDATA ) >

<!ELEMENT DVer ( #PCDATA ) >

<!ELEMENT TSet ( #PCDATA ) >

<!ELEMENT TInst ( #PCDATA ) >

<!ELEMENT DIter (Step*,Action+,Summary?,NodeArgs)>
<!ATTLIST DIter rID ID #REQUIRED iterID CDATA #REQUIRED>

<!ELEMENT DocLocation ( #PCDATA )>

<!ELEMENT Action (AName,AIter*,(Step|HtmlStep|Action)*, Summary,ActionMaintenanceSummary*, NodeArgs ) >
<!ATTLIST Action rID ID #REQUIRED>

<!ELEMENT AIter ((Step|HtmlStep|Action)*,DataMapping?, Summary?,NodeArgs) >
<!ATTLIST AIter rID ID #REQUIRED iterID CDATA #REQUIRED isCountable (False|True) "False" >

<!ELEMENT AName ( #PCDATA ) >

<!ELEMENT TestMaintenanceSummary (ActionMaintenanceSummary*) >
<!ATTLIST TestMaintenanceSummary ObjectsAdded CDATA #REQUIRED ObjectsUpdated CDATA #REQUIRED StepsUpdated CDATA #REQUIRED StepsComments CDATA #REQUIRED><!ELEMENT ActionMaintenanceSummary (ObjectChange* ) >
<!ATTLIST ActionMaintenanceSummary Action CDATA #REQUIRED Objects CDATA #REQUIRED Updated CDATA #REQUIRED LinesTotal CDATA #REQUIRED Added CDATA #REQUIRED LinesUpdated CDATA #REQUIRED>

<!ELEMENT ObjectChange  (Hierarchy, PropertyChangeList* ) >
<!ATTLIST ObjectChange Operation CDATA #IMPLIED OriginalRepository CDATA #IMPLIED>

<!ELEMENT PropertyChangeList (PropertyDef*) >

<!ELEMENT PropertyDef (OriginalValue, NewValue) >
<!ATTLIST PropertyDef PropName CDATA #REQUIRED OriginRegularExpression (True|False) "False" NewRegularExpression (True|False) "False" AddedProperty (True|False) "False" >

<!ELEMENT OriginalValue ( #PCDATA )>

<!ELEMENT NewValue ( #PCDATA )>

<!ELEMENT Hierarchy  (ObjectName, Hierarchy*) >
<!ATTLIST Hierarchy MicClass CDATA #REQUIRED>

<!ELEMENT ObjectName  ( #PCDATA ) >

<!ELEMENT Step (Obj,Details,Time,TimeTick* ,(Step|HtmlStep|Doc)*, DataMapping?, NodeArgs) >
<!ATTLIST Step rID ID #REQUIRED retval CDATA #IMPLIED>

<!ELEMENT HtmlStep (HTML,TimeTick*,(Step|HtmlStep|Doc)*,NodeArgs) >
<!ATTLIST HtmlStep rID ID #REQUIRED >

<!ELEMENT Obj ( #PCDATA ) >
<!ATTLIST Obj plainTxt (False|True) "True">

<!ELEMENT Details ( #PCDATA ) >
<!ATTLIST Details plainTxt (False|True) "True">

<!ELEMENT Time ( #PCDATA ) >

<!ELEMENT HTML ( #PCDATA ) >

<!ELEMENT Disp ( #PCDATA ) >

<!ELEMENT TimeTick ( #PCDATA ) >

<!ELEMENT DataMapping ( DataMappedItem* )>
<!ELEMENT DataMappedItem EMPTY >
<!ATTLIST DataMappedItem dsName CDATA #REQUIRED >
<!ATTLIST DataMappedItem rowId CDATA #REQUIRED >

<!ELEMENT NodeArgs (Disp,TopPane?,BtmPane?,ExtendedInfo? )>
<!ATTLIST NodeArgs eType CDATA #REQUIRED icon CDATA #REQUIRED nRep CDATA #REQUIRED UserNote CDATA #IMPLIED filter (False|True) "True">
<!ATTLIST NodeArgs status (Passed|Failed|Done|Warning|Information) "Done">
<!ATTLIST NodeArgs iconSel CDATA #IMPLIED nType CDATA #IMPLIED MovieMarker CDATA "">
<!ATTLIST NodeArgs Source CDATA #IMPLIED SourceLine CDATA #IMPLIED StepFlowItemKey CDATA #IMPLIED >

<!ELEMENT TopPane (Path)>

<!ELEMENT BtmPane ( (Path|WR)?,ASHilite?)>
<!ATTLIST BtmPane vType CDATA "HTML">

<!ELEMENT Path ( #PCDATA ) >

<!ELEMENT ASHilite ( #PCDATA ) >

<!ELEMENT WR ( #PCDATA ) >

<!ELEMENT ExtendedInfo ( StepData ) >

<!ATTLIST ExtendedInfo StepType CDATA #REQUIRED>
<!ELEMENT DT (NodeArgs) >
<!ATTLIST DT rID ID #REQUIRED>

<!ELEMENT Summary (Param*)>
<!ATTLIST Summary sTime CDATA #IMPLIED eTime CDATA #IMPLIED passed CDATA #IMPLIED failed CDATA #IMPLIED warnings CDATA #IMPLIED retval CDATA #IMPLIED stopped (False|True) "False" >

<!ELEMENT Param (ParamName,ParamVal)+ >
<!ATTLIST Param paramInOut (In|Out) "In">

<!ELEMENT ParamName ( #PCDATA ) >

<!ELEMENT ParamVal ( #PCDATA ) >

]
>
<Report ver="2.0" tmZone="GMT Standard Time">
<General productName="Vugen" productVer="2020" os="" host="DESKTOP-D80A036"><DocLocation><![CDATA[C:\LoadTests\ReviewTLevelPages]]></DocLocation></General>
<Doc rID="T1"   productName= "Vugen"  >
<DName><![CDATA[ReviewTLevelPages]]></DName>
<Res><![CDATA[result1]]></Res>
<Action rID="T2">
<AName><![CDATA[Init]]></AName>
<Summary sTime="21/08/2020 - 12:59:33" eTime="21/08/2020 - 12:59:33" passed="0" failed="0" warnings="0" ></Summary>
<NodeArgs eType="StartAction" icon="2" nRep="5" >
<Disp><![CDATA[Init Summary]]></Disp>
</NodeArgs>
</Action>
<DIter rID="T3" iterID="1" >
<Action rID="T4">
<AName><![CDATA[Action]]></AName>
<Step rID="T5">
<Obj plainTxt="False" ><![CDATA[Navigate]]></Obj>
<Details plainTxt="False" ><![CDATA[1: Navigate to https://test.manage-tlev....tlevels.gov.uk/ was finished]]></Details>
<Time><![CDATA[21/08/2020 - 12:59:37]]></Time>
<TimeTick>1598011177</TimeTick>
<NodeArgs eType="General" icon="0" nRep="9" status="Passed" >
<Disp><![CDATA[Navigate]]></Disp>
</NodeArgs>
</Step>
<Step rID="T6">
<Obj plainTxt="False" ><![CDATA[Wait]]></Obj>
<Details plainTxt="False" ><![CDATA[: Wait until Department for Education... heading exists was finished]]></Details>
<Time><![CDATA[21/08/2020 - 12:59:39]]></Time>
<TimeTick>1598011179</TimeTick>
<NodeArgs eType="General" icon="0" nRep="10" status="Passed" >
<Disp><![CDATA[Wait]]></Disp>
</NodeArgs>
</Step>
<Step rID="T7">
<Obj plainTxt="False" ><![CDATA[Click]]></Obj>
<Details plainTxt="False" ><![CDATA[2: Click on Start now button was finished]]></Details>
<Time><![CDATA[21/08/2020 - 12:59:40]]></Time>
<TimeTick>1598011180</TimeTick>
<NodeArgs eType="General" icon="0" nRep="11" status="Passed" >
<Disp><![CDATA[Click]]></Disp>
</NodeArgs>
</Step>
<Step rID="T8">
<Obj plainTxt="False" ><![CDATA[Click]]></Obj>
<Details plainTxt="False" ><![CDATA[3.1: Click on Email address textbox was finished]]></Details>
<Time><![CDATA[21/08/2020 - 12:59:41]]></Time>
<TimeTick>1598011181</TimeTick>
<NodeArgs eType="General" icon="0" nRep="12" status="Passed" >
<Disp><![CDATA[Click]]></Disp>
</NodeArgs>
</Step>
<Step rID="T9">
<Obj plainTxt="False" ><![CDATA[Type]]></Obj>
<Details plainTxt="False" ><![CDATA[3.2: Type ao_user_app@tleveltest.com in Email address textbox was finished]]></Details>
<Time><![CDATA[21/08/2020 - 12:59:42]]></Time>
<TimeTick>1598011182</TimeTick>
<NodeArgs eType="General" icon="0" nRep="13" status="Passed" >
<Disp><![CDATA[Type]]></Disp>
</NodeArgs>
</Step>
<Step rID="T10">
<Obj plainTxt="False" ><![CDATA[Click]]></Obj>
<Details plainTxt="False" ><![CDATA[3.3: Click on Password passwordbox was finished]]></Details>
<Time><![CDATA[21/08/2020 - 12:59:43]]></Time>
<TimeTick>1598011183</TimeTick>
<NodeArgs eType="General" icon="0" nRep="14" status="Passed" >
<Disp><![CDATA[Click]]></Disp>
</NodeArgs>
</Step>
<Step rID="T11">
<Obj plainTxt="False" ><![CDATA[Type]]></Obj>
<Details plainTxt="False" ><![CDATA[3.4: Type ************* in Password passwordbox was finished]]></Details>
<Time><![CDATA[21/08/2020 - 12:59:45]]></Time>
<TimeTick>1598011185</TimeTick>
<NodeArgs eType="General" icon="0" nRep="15" status="Passed" >
<Disp><![CDATA[Type]]></Disp>
</NodeArgs>
</Step>
<Step rID="T12">
<Obj plainTxt="False" ><![CDATA[Wait]]></Obj>
<Details plainTxt="False" ><![CDATA[: Wait until Select your organisation heading exists was finished]]></Details>
<Time><![CDATA[21/08/2020 - 12:59:48]]></Time>
<TimeTick>1598011188</TimeTick>
<NodeArgs eType="General" icon="0" nRep="16" status="Passed" >
<Disp><![CDATA[Wait]]></Disp>
</NodeArgs>
</Step>
<Step rID="T13">
<Obj plainTxt="False" ><![CDATA[Click]]></Obj>
<Details plainTxt="False" ><![CDATA[3.5: Click on Sign in button was finished]]></Details>
<Time><![CDATA[21/08/2020 - 12:59:48]]></Time>
<TimeTick>1598011188</TimeTick>
<NodeArgs eType="General" icon="0" nRep="17" status="Passed" >
<Disp><![CDATA[Click]]></Disp>
</NodeArgs>
</Step>
<Step rID="T14">
<Obj plainTxt="False" ><![CDATA[Click]]></Obj>
<Details plainTxt="False" ><![CDATA[4: Click on PEARSON EDUCATION LIMITED...  was finished]]></Details>
<Time><![CDATA[21/08/2020 - 12:59:49]]></Time>
<TimeTick>1598011189</TimeTick>
<NodeArgs eType="General" icon="0" nRep="18" status="Passed" >
<Disp><![CDATA[Click]]></Disp>
</NodeArgs>
</Step>
<Step rID="T15">
<Obj plainTxt="False" ><![CDATA[Click]]></Obj>
<Details plainTxt="False" ><![CDATA[5: Click on Continue button was finished]]></Details>
<Time><![CDATA[21/08/2020 - 12:59:52]]></Time>
<TimeTick>1598011192</TimeTick>
<NodeArgs eType="General" icon="0" nRep="19" status="Passed" >
<Disp><![CDATA[Click]]></Disp>
</NodeArgs>
</Step>
<Step rID="T16">
<Obj plainTxt="False" ><![CDATA[Click]]></Obj>
<Details plainTxt="False" ><![CDATA[6: Click on T Levels link was finished]]></Details>
<Time><![CDATA[21/08/2020 - 12:59:55]]></Time>
<TimeTick>1598011195</TimeTick>
<NodeArgs eType="General" icon="0" nRep="20" status="Passed" >
<Disp><![CDATA[Click]]></Disp>
</NodeArgs>
</Step>
<Step rID="T17">
<Obj plainTxt="False" ><![CDATA[Wait]]></Obj>
<Details plainTxt="False" ><![CDATA[: Wait until T Level details heading exists was finished]]></Details>
<Time><![CDATA[21/08/2020 - 12:59:57]]></Time>
<TimeTick>1598011197</TimeTick>
<NodeArgs eType="General" icon="0" nRep="21" status="Passed" >
<Disp><![CDATA[Wait]]></Disp>
</NodeArgs>
</Step>
<Step rID="T18">
<Obj plainTxt="False" ><![CDATA[Click]]></Obj>
<Details plainTxt="False" ><![CDATA[7: Click on View T Level in Creative... link was finished]]></Details>
<Time><![CDATA[21/08/2020 - 12:59:57]]></Time>
<TimeTick>1598011197</TimeTick>
<NodeArgs eType="General" icon="0" nRep="22" status="Passed" >
<Disp><![CDATA[Click]]></Disp>
</NodeArgs>
</Step>
<Step rID="T19">
<Obj plainTxt="False" ><![CDATA[Click]]></Obj>
<Details plainTxt="False" ><![CDATA[8: Click on Query T Level details link was finished]]></Details>
<Time><![CDATA[21/08/2020 - 12:59:59]]></Time>
<TimeTick>1598011199</TimeTick>
<NodeArgs eType="General" icon="0" nRep="23" status="Passed" >
<Disp><![CDATA[Click]]></Disp>
</NodeArgs>
</Step>
<Step rID="T20">
<Obj plainTxt="False" ><![CDATA[Wait]]></Obj>
<Details plainTxt="False" ><![CDATA[: Wait until T Level details heading exists was finished]]></Details>
<Time><![CDATA[21/08/2020 - 13:00:00]]></Time>
<TimeTick>1598011200</TimeTick>
<NodeArgs eType="General" icon="0" nRep="24" status="Passed" >
<Disp><![CDATA[Wait]]></Disp>
</NodeArgs>
</Step>
<Step rID="T21">
<Obj plainTxt="False" ><![CDATA[Click]]></Obj>
<Details plainTxt="False" ><![CDATA[9: Click on Back link was finished]]></Details>
<Time><![CDATA[21/08/2020 - 13:00:00]]></Time>
<TimeTick>1598011200</TimeTick>
<NodeArgs eType="General" icon="0" nRep="25" status="Passed" >
<Disp><![CDATA[Click]]></Disp>
</NodeArgs>
</Step>
<Step rID="T22">
<Obj plainTxt="False" ><![CDATA[Click]]></Obj>
<Details plainTxt="False" ><![CDATA[10: Click on Return to your T Levels... link was finished]]></Details>
<Time><![CDATA[21/08/2020 - 13:00:01]]></Time>
<TimeTick>1598011201</TimeTick>
<NodeArgs eType="General" icon="0" nRep="26" status="Passed" >
<Disp><![CDATA[Click]]></Disp>
</NodeArgs>
</Step>
<Step rID="T23">
<Obj plainTxt="False" ><![CDATA[Click]]></Obj>
<Details plainTxt="False" ><![CDATA[11: Click on View T Level in Design,... link was finished]]></Details>
<Time><![CDATA[21/08/2020 - 13:00:02]]></Time>
<TimeTick>1598011202</TimeTick>
<NodeArgs eType="General" icon="0" nRep="27" status="Passed" >
<Disp><![CDATA[Click]]></Disp>
</NodeArgs>
</Step>
<Step rID="T24">
<Obj plainTxt="False" ><![CDATA[Click]]></Obj>
<Details plainTxt="False" ><![CDATA[12: Click on Query T Level details link was finished]]></Details>
<Time><![CDATA[21/08/2020 - 13:00:03]]></Time>
<TimeTick>1598011203</TimeTick>
<NodeArgs eType="General" icon="0" nRep="28" status="Passed" >
<Disp><![CDATA[Click]]></Disp>
</NodeArgs>
</Step>
<Step rID="T25">
<Obj plainTxt="False" ><![CDATA[Click]]></Obj>
<Details plainTxt="False" ><![CDATA[13: Click on Back link was finished]]></Details>
<Time><![CDATA[21/08/2020 - 13:00:05]]></Time>
<TimeTick>1598011205</TimeTick>
<NodeArgs eType="General" icon="0" nRep="29" status="Passed" >
<Disp><![CDATA[Click]]></Disp>
</NodeArgs>
</Step>
<Step rID="T26">
<Obj plainTxt="False" ><![CDATA[Click]]></Obj>
<Details plainTxt="False" ><![CDATA[14: Click on Return to your T Levels... link was finished]]></Details>
<Time><![CDATA[21/08/2020 - 13:00:06]]></Time>
<TimeTick>1598011206</TimeTick>
<NodeArgs eType="General" icon="0" nRep="30" status="Passed" >
<Disp><![CDATA[Click]]></Disp>
</NodeArgs>
</Step>
<Step rID="T27">
<Obj plainTxt="False" ><![CDATA[Click]]></Obj>
<Details plainTxt="False" ><![CDATA[15: Click on Sign out link was finished]]></Details>
<Time><![CDATA[21/08/2020 - 13:00:07]]></Time>
<TimeTick>1598011207</TimeTick>
<NodeArgs eType="General" icon="0" nRep="31" status="Passed" >
<Disp><![CDATA[Click]]></Disp>
</NodeArgs>
</Step>
<Summary sTime="21/08/2020 - 12:59:35" eTime="21/08/2020 - 13:00:07" passed="23" failed="0" warnings="0" ></Summary>
<NodeArgs eType="StartAction" icon="2" nRep="8" status="Passed" >
<Disp><![CDATA[Action Summary]]></Disp>
</NodeArgs>
</Action>
<NodeArgs eType="StartIteration" icon="3" nRep="7" status="Passed" >
<Disp><![CDATA[ReviewTLevelPages Iteration 1 (Row 1)]]></Disp>
</NodeArgs>
</DIter>
<Action rID="T28">
<AName><![CDATA[End]]></AName>
<Summary sTime="21/08/2020 - 13:00:07" eTime="21/08/2020 - 13:00:07" passed="0" failed="0" warnings="0" ></Summary>
<NodeArgs eType="StartAction" icon="2" nRep="34" >
<Disp><![CDATA[End Summary]]></Disp>
</NodeArgs>
</Action>
<Summary sTime="21/08/2020 - 12:59:31" eTime="21/08/2020 - 13:00:13" passed="23" failed="0" warnings="0" ></Summary>
<NodeArgs eType="StartTest" icon="1" nRep="4" status="Passed" >
<Disp><![CDATA[Test ReviewTLevelPages Summary]]></Disp>
</NodeArgs>
</Doc>
</Report>